{
  "twin": "slack",
  "sdk_target": {
    "package": "github.com/slack-go/slack",
    "language": "go",
    "version": "latest"
  },
  "build": 21,
  "generated_at": "2026-10-06T00:00:00Z",
  "sources": {
    "openapi": {
      "origin": "none",
      "url": ""
    },
    "sdk_analysis": {
      "method": "manual",
      "repo": "https://github.com/slack-go/slack"
    }
  }
}
