{
  "twin": "shopify",
  "sdk_target": {
    "package": "github.com/bold-commerce/go-shopify",
    "language": "go",
    "version": "v3"
  },
  "build": 1,
  "generated_at": "2026-04-02T00:00:00Z",
  "sources": {
    "openapi": {
      "origin": "none",
      "url": ""
    },
    "sdk_analysis": {
      "method": "manual",
      "repo": "https://github.com/bold-commerce/go-shopify"
    }
  }
}
