{
  "twin": "clerk",
  "sdk_target": {
    "package": "github.com/clerk/clerk-sdk-go",
    "language": "go",
    "version": "v2"
  },
  "build": 1,
  "generated_at": "2026-02-12T15:26:50-08:00",
  "sources": {
    "openapi": {
      "origin": "vendor_published",
      "url": "https://clerk.com/docs/reference/backend-api"
    },
    "sdk_analysis": {
      "method": "manual",
      "repo": "https://github.com/clerk/clerk-sdk-go"
    }
  }
}
