{
  "twin": "twilio",
  "sdk_target": {
    "package": "github.com/twilio/twilio-go",
    "language": "go",
    "version": "v1"
  },
  "build": 1,
  "generated_at": "2026-02-12T15:26:50-08:00",
  "sources": {
    "openapi": {
      "origin": "vendor_published",
      "url": "https://github.com/twilio/twilio-oai/tree/main/spec/json"
    },
    "sdk_analysis": {
      "method": "manual",
      "repo": "https://github.com/twilio/twilio-go"
    }
  }
}
