{
  "twin": "posthog",
  "sdk_target": {
    "package": "github.com/posthog/posthog-go",
    "language": "go",
    "version": "v0"
  },
  "build": 2,
  "generated_at": "2026-03-09T00:00:00-08:00",
  "sources": {
    "openapi": {
      "origin": "vendor_published",
      "url": "https://posthog.com/docs/api"
    },
    "sdk_analysis": {
      "method": "manual",
      "repo": "https://github.com/posthog/posthog-go"
    }
  }
}
